{
	"schemaVersion": 1,
	"stage": "stage-6-worktree-doctor",
	"capturedAt": "2026-08-06T16:04:18.769Z",
	"run": {
		"id": "stage6-20260806t160000z-4a8894c2",
		"logRoot": "evidence/stage-6-doctor-run",
		"temporaryRoot": "/private/var/folders/gb/4tst5hyd1575hz7hknb6w5b00000gn/T/devenv-stage6-stage6-20260806t160000z-4a8894c2",
		"isolatedHome": "/private/var/folders/gb/4tst5hyd1575hz7hknb6w5b00000gn/T/devenv-stage6-stage6-20260806t160000z-4a8894c2/home",
		"originPath": "/Users/mrcr/Code/templates/devenv"
	},
	"source": {
		"baseSha": "9961f7e6c6797738012665c16222ff1afc1441cd",
		"implementationSha": "4a8894c2fb05c75bf2959ecedf9ca72ceb4f675b",
		"treeClean": true
	},
	"host": {
		"os": "darwin",
		"architecture": "arm64",
		"kernel": "25.5.0",
		"home": "/Users/mrcr",
		"dockerVersion": "29.4.0",
		"devcontainerCliVersion": "0.87.0",
		"pythonVersion": "3.12.8",
		"curlPresent": true
	},
	"doctor": {
		"command": "bash scripts/worktree/doctor.sh",
		"schemaVersion": 1,
		"checkIds": [
			"host.context",
			"host.command.git",
			"host.command.engine",
			"host.command.cli",
			"host.command.python3",
			"host.command.curl",
			"git.worktree-integrity",
			"host.engine-daemon",
			"state.environment",
			"state.manifest-state",
			"state.values",
			"state.paths",
			"state.manifest",
			"container.record",
			"container.ready-record",
			"container.runtime",
			"container.ownership",
			"container.definition",
			"container.fast-ready",
			"container.workspace-mount",
			"container.git-mount",
			"container.port",
			"container.volumes",
			"container.tools",
			"caddy.binary",
			"caddy.config",
			"caddy.import",
			"caddy.snippet",
			"route.direct",
			"route.friendly",
			"registry.readable",
			"registry.lock",
			"registry.entry",
			"registry.offset-match",
			"registry.port-collision",
			"manifests.port-collision"
		],
		"exitCodes": {
			"healthy": 0,
			"failure": 1,
			"invalidArgument": 2
		}
	},
	"worktrees": [
		{
			"name": "alpha",
			"path": "/private/var/folders/gb/4tst5hyd1575hz7hknb6w5b00000gn/T/devenv-stage6-stage6-20260806t160000z-4a8894c2/s6/alpha",
			"workspaceId": "devenv-s6-alpha",
			"family": "s6-alpha",
			"offset": 942,
			"publishedHostPort": 9022,
			"directUrl": "http://127.0.0.1:9022",
			"containerId": "f3978ef37c752e742d6a5bcaa7f72995c7258e44a6726deb9a3a42e64c1cafa8",
			"devcontainerId": "1n8tqp6qi7cj50etu3aaiq67im43seq62rd8rp8ot6ose6q9jt6n",
			"definitionFingerprint": "d6ff95c907fd7c44a4e8ddb11fbdecf434a468a19c1fb6e2d9fe94ba76588654"
		},
		{
			"name": "beta",
			"path": "/private/var/folders/gb/4tst5hyd1575hz7hknb6w5b00000gn/T/devenv-stage6-stage6-20260806t160000z-4a8894c2/s6/beta",
			"workspaceId": "devenv-s6-beta",
			"family": "s6-beta",
			"offset": 481,
			"publishedHostPort": 8561,
			"directUrl": "http://127.0.0.1:8561",
			"containerId": "1d3986e95245c17eae55b78cadd52974dc0bff3dc66254fe1ad4d8e49a2c2bc5",
			"devcontainerId": "15s9gmluptpc50bftqht1d8s4vinjfl418kd7hhbnogqam5qpmue",
			"definitionFingerprint": "d6ff95c907fd7c44a4e8ddb11fbdecf434a468a19c1fb6e2d9fe94ba76588654"
		}
	],
	"commands": [
		{
			"id": "doctor-guard",
			"command": ["bun", "run", "worktree:check"],
			"runId": "stage6-20260806t160000z-4a8894c2",
			"startedAt": "2026-08-06T16:00:00.651Z",
			"completedAt": "2026-08-06T16:00:00.870Z",
			"durationMs": 219,
			"stdoutPath": "evidence/stage-6-doctor-run/doctor-guard.stdout",
			"stderrPath": "evidence/stage-6-doctor-run/doctor-guard.stderr",
			"stdoutSha256": "b8fc787fad0cc3f993f929092349ec69500a2a05c0162ba2b0fa03d85e0fb54c",
			"stderrSha256": "b21172c02c58cf08110b00d513cdbce996f4ccd7813f16729358cd34cb9daad7",
			"exitCode": 0,
			"status": "pass"
		},
		{
			"id": "hermetic-selftest",
			"command": ["bash", "scripts/worktree/selftest.sh"],
			"runId": "stage6-20260806t160000z-4a8894c2",
			"startedAt": "2026-08-06T16:00:00.871Z",
			"completedAt": "2026-08-06T16:00:02.914Z",
			"durationMs": 2043,
			"stdoutPath": "evidence/stage-6-doctor-run/hermetic-selftest.stdout",
			"stderrPath": "evidence/stage-6-doctor-run/hermetic-selftest.stderr",
			"stdoutSha256": "2459e683a62ac78ab509f3f35b0038741ea8a8224c09001842bdabecff2337be",
			"stderrSha256": "e3b0c44298fc1c149afbf4c8996fb92427ae41e4649b934ca495991b7852b855",
			"exitCode": 0,
			"status": "pass"
		},
		{
			"id": "doctor-known-bad-fixtures",
			"command": ["bun", "test", "scripts/template/__tests__/worktree.test.ts"],
			"runId": "stage6-20260806t160000z-4a8894c2",
			"startedAt": "2026-08-06T16:00:02.915Z",
			"completedAt": "2026-08-06T16:02:44.066Z",
			"durationMs": 161151,
			"stdoutPath": "evidence/stage-6-doctor-run/doctor-known-bad-fixtures.stdout",
			"stderrPath": "evidence/stage-6-doctor-run/doctor-known-bad-fixtures.stderr",
			"stdoutSha256": "ca35b94f2c5b623fccbd1cc9e77eef3e30a6fcf4b045842fc1353f7ae6d8ea32",
			"stderrSha256": "e38a4c613ef8ce4f683be486b632a9f8e487112cfe38215fce1407640de207fb",
			"exitCode": 0,
			"status": "pass"
		},
		{
			"id": "doctor-check-inventory",
			"command": ["bash", "scripts/worktree/doctor.sh", "--list-checks"],
			"runId": "stage6-20260806t160000z-4a8894c2",
			"startedAt": "2026-08-06T16:02:44.067Z",
			"completedAt": "2026-08-06T16:02:44.165Z",
			"durationMs": 98,
			"stdoutPath": "evidence/stage-6-doctor-run/doctor-check-inventory.stdout",
			"stderrPath": "evidence/stage-6-doctor-run/doctor-check-inventory.stderr",
			"stdoutSha256": "2ad4346b1bfdb30b384ad1490f7c852af0273f618e8d6deb4334b98aa2321e7d",
			"stderrSha256": "e3b0c44298fc1c149afbf4c8996fb92427ae41e4649b934ca495991b7852b855",
			"exitCode": 0,
			"status": "pass"
		},
		{
			"id": "journey-worktree-a-up",
			"command": [
				"bash",
				"-c",
				"set -euo pipefail\nreal_state_digest() {\n\t(cd \"/Users/mrcr/.config/devcontainer\" 2>/dev/null &&\n\t\tfind ports-registry worktrees caddy -type f -print0 2>/dev/null |\n\t\tsort -z | xargs -0 shasum -a 256 2>/dev/null || true) |\n\t\tshasum -a 256 | awk '{ print $1 }'\n}\nprintf 'realCheckoutStateDigest=%s\\n' \"$(real_state_digest)\"\nexport HOME=\"/private/var/folders/gb/4tst5hyd1575hz7hknb6w5b00000gn/T/devenv-stage6-stage6-20260806t160000z-4a8894c2/home\"\nexport DOCKER_CONFIG=\"/Users/mrcr/.docker\"\nfor directory in secrets.d container-env codex-auth; do\n\tmkdir -p \"$HOME/.config/devcontainer/$directory\"\n\tchmod 700 \"$HOME/.config/devcontainer/$directory\"\ndone\nmkdir -p \"$HOME/.ssh\"\nchmod 700 \"$HOME/.ssh\"\nmkdir -p \"/private/var/folders/gb/4tst5hyd1575hz7hknb6w5b00000gn/T/devenv-stage6-stage6-20260806t160000z-4a8894c2/s6\"\ngit -C \"/Users/mrcr/Code/templates/devenv\" worktree add --detach --quiet \"/private/var/folders/gb/4tst5hyd1575hz7hknb6w5b00000gn/T/devenv-stage6-stage6-20260806t160000z-4a8894c2/s6/alpha\" 4a8894c2fb05c75bf2959ecedf9ca72ceb4f675b\ncd \"/private/var/folders/gb/4tst5hyd1575hz7hknb6w5b00000gn/T/devenv-stage6-stage6-20260806t160000z-4a8894c2/s6/alpha\"\nprintf 'headSha=%s\\n' \"$(git rev-parse HEAD)\"\nprintf 'gitDir=%s\\n' \"$(git rev-parse --path-format=absolute --git-dir)\"\nprintf 'gitCommonDir=%s\\n' \"$(git rev-parse --path-format=absolute --git-common-dir)\"\nprintf 'isolatedHome=%s\\n' \"/private/var/folders/gb/4tst5hyd1575hz7hknb6w5b00000gn/T/devenv-stage6-stage6-20260806t160000z-4a8894c2/home\"\nbash scripts/worktree/up.sh\ncontainer_id=\"$(bash scripts/worktree/ensure.sh --check-ready)\"\nprintf 'containerId=%s\\n' \"$container_id\"\nprintf 'environmentJson=%s\\n' \"$(bash scripts/worktree/env.sh --json | python3 -c 'import json,sys; print(json.dumps(json.load(sys.stdin), sort_keys=True, separators=(\",\", \":\")))')\"\nprintf 'manifestPath=%s\\n' \"$(bash scripts/worktree/manifest.sh path)\"\nprintf 'definitionFingerprint=%s\\n' \"$(bash scripts/worktree/ensure.sh --definition-fingerprint)\"\ndevelopment_user=\"$(bash -c '. \"$1/scripts/worktree/lib.sh\"; wt_contract_value \"$2\"' bash \"/private/var/folders/gb/4tst5hyd1575hz7hknb6w5b00000gn/T/devenv-stage6-stage6-20260806t160000z-4a8894c2/s6/alpha\" development_user)\"\ncontainer_workspace=\"$(bash -c '. \"$1/scripts/worktree/lib.sh\"; wt_contract_value \"$2\"' bash \"/private/var/folders/gb/4tst5hyd1575hz7hknb6w5b00000gn/T/devenv-stage6-stage6-20260806t160000z-4a8894c2/s6/alpha\" container_workspace)\"\ncontainer_port=\"$(bash -c '. \"$1/scripts/worktree/lib.sh\"; wt_contract_value \"$2\"' bash \"/private/var/folders/gb/4tst5hyd1575hz7hknb6w5b00000gn/T/devenv-stage6-stage6-20260806t160000z-4a8894c2/s6/alpha\" published_container_port)\"\nprintf 'publishedMapping=%s\\n' \"$(docker port \"$container_id\" \"$container_port/tcp\" | head -1)\"\nprintf 'containerVolumes=%s\\n' \"$(docker inspect --format '{{range .Mounts}}{{if eq .Type \"volume\"}}{{.Name}} {{end}}{{end}}' \"$container_id\")\"\ndocker exec --detach --user \"$development_user\" --workdir \"$container_workspace\" \\\n\t\"$container_id\" /usr/bin/bash -lc \\\n\t\"exec python -m http.server $container_port --bind 0.0.0.0\"\nprintf 'listener=python -m http.server %s\\n' \"$container_port\"\ndirect=\"$(bash -c '. \"$1/scripts/worktree/lib.sh\"; wt_env_file_value \"$REPO_ROOT/$(wt_contract_value generated_environment)\" \"$2\"' bash \"/private/var/folders/gb/4tst5hyd1575hz7hknb6w5b00000gn/T/devenv-stage6-stage6-20260806t160000z-4a8894c2/s6/alpha\" DEVENV_DIRECT_URL)\"\nprintf 'directUrl=%s\\n' \"$direct\"\ncode=000\nfor attempt in 1 2 3 4 5 6 7 8 9 10; do\n\tcode=\"$(curl --silent --max-time 5 --output /dev/null --write-out '%{http_code}' \"$direct\" || printf 000)\"\n\tcase \"$code\" in 2[0-9][0-9] | 3[0-9][0-9]) break ;; esac\n\tsleep 2\ndone\nprintf 'directProbeCode=%s\\n' \"$code\"\n[ \"$code\" = \"200\" ]\nprintf 'listenerAnswers=true\\n'"
			],
			"runId": "stage6-20260806t160000z-4a8894c2",
			"startedAt": "2026-08-06T16:02:44.166Z",
			"completedAt": "2026-08-06T16:03:18.541Z",
			"durationMs": 34375,
			"stdoutPath": "evidence/stage-6-doctor-run/journey-worktree-a-up.stdout",
			"stderrPath": "evidence/stage-6-doctor-run/journey-worktree-a-up.stderr",